{
  "schemaVersion": 1,
  "id": "run-20260724-150000",
  "loopId": "nightly-dependency-report",
  "sessionId": "11111111-1111-4111-8111-111111111111",
  "trigger": "schedule",
  "status": "succeeded",
  "scheduledFor": "2026-07-24T15:00:00Z",
  "startedAt": "2026-07-24T15:00:02Z",
  "endedAt": "2026-07-24T15:04:14Z",
  "exitCode": 0,
  "signal": null,
  "retryOf": null,
  "attempts": [
    {
      "number": 1,
      "startedAt": "2026-07-24T15:00:02Z",
      "endedAt": "2026-07-24T15:04:14Z",
      "exitCode": 0,
      "signal": null
    }
  ]
}
